<?xml version="1.0" encoding="UTF-8"?>
<!DOCTYPE eventos SYSTEM "doctype.dtd">
<eventos>
    <evento>
        <presencial>
            <direccion>Calle Falsa 123</direccion>
            <sala>Auditorio 2</sala>
          <sala>Auditorio 2</sala>
        </presencial>
    </evento>

    <evento>
        <presencial>
            <plataforma>Zoom</plataforma>
            <enlace>https://zoom.us/j/123456789</enlace>
        </presencial>
    </evento>
</eventos>